{
  "id": "SR-001",
  "type": "stakeholder",
  "title": "nlohmann::json-like API surface",
  "description": "Developers using pjson should encounter a familiar API surface inspired by nlohmann::json, including value access by path, iteration over arrays and objects, type checking, and convenient construction of JSON structures.",
  "rationale": "nlohmann::json is the de facto standard C++ JSON library. Familiarity reduces learning curve and adoption friction.",
  "status": "approved",
  "priority": "high",
  "version": "1.0",
  "created": "2026-03-21",
  "author": "netkeep80",
  "traces_from": ["BR-001"],
  "traces_to": ["FR-002", "FR-003", "FR-004"],
  "implementation_files": [],
  "test_files": [],
  "acceptance_criteria": [
    "API supports JSON value types: null, boolean, integer, float, string, array, object",
    "Values can be accessed by key (objects) and index (arrays)",
    "Range-based for loops work for arrays and objects"
  ],
  "tags": ["api", "usability"]
}
