{
  "id": "FR-006",
  "type": "functional",
  "title": "Валидация трассировки требований в CI",
  "description": "CI-пайплайн должен валидировать ссылки трассировки между требованиями: все указанные ID в traces_from и traces_to должны существовать, а двунаправленные ссылки должны быть согласованы (если A traces_to B, то B должен traces_from A). Пути к файлам реализации и тестов должны проверяться на существование.",
  "rationale": "Валидация трассировки гарантирует, что сеть требований остаётся связной и согласованной, предотвращая осиротевшие или висячие ссылки.",
  "status": "approved",
  "priority": "medium",
  "version": "1.0",
  "created": "2026-03-21",
  "author": "netkeep80",
  "traces_from": ["SR-003"],
  "traces_to": [],
  "implementation_files": ["scripts/validate-requirements.js"],
  "test_files": [],
  "acceptance_criteria": [
    "Все ссылки на ID требований проверяются на существование",
    "Проверяется согласованность двунаправленной трассировки",
    "Выдаются предупреждения для требований без файлов реализации или тестов",
    "Пайплайн завершается с ошибкой при нарушенных ссылках трассировки"
  ],
  "tags": ["ci", "validation", "traceability"]
}
