{
  "id": "FR-013",
  "type": "functional",
  "title": "Восстановление данных pjson через обход типизированных AVL-деревьев",
  "description": "pjson должна предоставлять механизм восстановления JSON-данных при повреждении персистентного адресного пространства (ПАП). Восстановление основано на обходе выделенных AVL-деревьев для каждого типа узла: поскольку все узлы одного типа объединены в одно AVL-дерево, возможно восстановить структуру данных, перебирая неповреждённые узлы в каждом дереве.",
  "rationale": "Повреждение ПАП может произойти при аварийном завершении процесса, сбое оборудования или ошибке записи на диск. Наличие выделенных AVL-деревьев для каждого типа узла обеспечивает независимый доступ к данным каждого типа, что позволяет восстановить максимум данных даже при частичном повреждении.",
  "status": "draft",
  "priority": "medium",
  "version": "1.0",
  "created": "2026-03-22",
  "author": "netkeep80",
  "traces_from": ["BR-003", "FR-009"],
  "traces_to": [],
  "implementation_files": [],
  "test_files": [],
  "acceptance_criteria": [
    "API предоставляет функцию восстановления данных из повреждённого ПАП",
    "Восстановление обходит каждое типизированное AVL-дерево независимо",
    "Повреждённые узлы пропускаются, неповреждённые сохраняются",
    "Результат восстановления содержит отчёт: количество восстановленных и потерянных узлов по типам",
    "Восстановленные данные записываются в новый (чистый) экземпляр ПАП"
  ],
  "tags": ["recovery", "resilience", "avl-tree", "dbms"]
}
