{
  "id": "FR-012",
  "type": "functional",
  "title": "Разграничение прав доступа по узлам и ветвям",
  "description": "pjson должна поддерживать разграничение прав доступа на уровне отдельных узлов и целых ветвей JSON-дерева. Контроль доступа должен позволять ограничивать операции чтения, записи и удаления для различных пользователей или ролей на любом уровне иерархии JSON-структуры.",
  "rationale": "Для реализации СУБД на основе pjson (pjson_db) необходим механизм разграничения прав доступа. Архитектура леса AVL-деревьев с фиксированными типами узлов естественно поддерживает хранение метаданных доступа как дополнительных атрибутов узлов.",
  "status": "draft",
  "priority": "medium",
  "version": "1.0",
  "created": "2026-03-22",
  "author": "netkeep80",
  "traces_from": ["BR-003"],
  "traces_to": [],
  "implementation_files": [],
  "test_files": [],
  "acceptance_criteria": [
    "Права доступа могут быть назначены на уровне отдельного узла JSON",
    "Права доступа могут быть назначены на уровне ветви (наследуются дочерними узлами)",
    "Поддерживаются операции: чтение, запись, удаление с раздельным контролем",
    "Проверка прав доступа выполняется при каждой операции CRUD",
    "Метаданные доступа персистентны и хранятся в ПАП"
  ],
  "tags": ["dbms", "security", "access-control"]
}
