{
  "id": "FR-001",
  "type": "functional",
  "title": "Хранение JSON-узлов через лес AVL-деревьев pmm",
  "description": "JSON-узлы должны выделяться, храниться и управляться исключительно через механизм леса AVL-деревьев pmm. Каждое JSON-значение (null, boolean, integer, real, string, array, object) представляется как блок, управляемый pmm. Массивы используют parray для доступа по индексу за O(1). Объекты используют pmap для поиска по ключу за O(log n). Строки используют pstringview (интернированные, только для чтения) для ключей и pstring (изменяемые) для значений.",
  "rationale": "Это устраняет отдельный пул-аллокатор, используемый в прототипе BinDiffSynchronizer, и соответствует требованию единой архитектуры BR-002.",
  "status": "proposed",
  "priority": "critical",
  "version": "1.0",
  "created": "2026-03-21",
  "author": "netkeep80",
  "traces_from": ["BR-002", "SR-002"],
  "traces_to": [],
  "implementation_files": [],
  "test_files": [],
  "acceptance_criteria": [
    "JSON-узлы используют выделение через pmm (без ppool или пользовательского пула)",
    "Массивы построены на parray с доступом по индексу за O(1)",
    "Объекты построены на pmap с поиском по ключу за O(log n)",
    "Строковые ключи используют pstringview для интернирования и дедупликации",
    "Строковые значения используют pstring для изменяемости"
  ],
  "tags": ["core", "pmm", "avl-tree", "node"]
}
