{
  "id": "FR-011",
  "type": "functional",
  "title": "Индексация и полнотекстовый поиск",
  "description": "pjson должна поддерживать возможность создания индексов для ускорения поиска по JSON-данным. Полнотекстовый поиск должен быть реализован раздельно для pstringview (интернированных строк) и pstring (строковых значений). Индексы строятся на основе AVL-деревьев, используя архитектуру леса AVL-деревьев pmm.",
  "rationale": "Для реализации СУБД на основе pjson (pjson_db) необходимы эффективные механизмы поиска данных. Раздельный поиск по pstringview и pstring необходим, так как pstringview содержит интернированные ключи/пути (уникальные, неизменяемые), а pstring — строковые значения (изменяемые, могут дублироваться).",
  "status": "draft",
  "priority": "medium",
  "version": "1.0",
  "created": "2026-03-22",
  "author": "netkeep80",
  "traces_from": ["BR-003"],
  "traces_to": [],
  "implementation_files": [],
  "test_files": [],
  "acceptance_criteria": [
    "Поддерживается создание индекса по заданному JSON-пути для ускорения поиска",
    "Полнотекстовый поиск по pstringview (интернированные строки) реализован через AVL-дерево",
    "Полнотекстовый поиск по pstring (строковые значения) реализован через AVL-дерево",
    "Поиск по индексу обеспечивает сложность O(log n)",
    "Индексы персистентны и сохраняются между перезапусками процесса"
  ],
  "tags": ["dbms", "indexing", "search", "fulltext"]
}
