{
  "id": "BR-003",
  "type": "business",
  "title": "pjson как основа для персистентной СУБД (pjson_db)",
  "description": "pjson должна проектироваться с учётом перспективы создания на её основе персистентной СУБД (pjson_db) и виртуальной машины (pjsonRVM, по аналогии с jsonRVM). Архитектура должна обеспечивать возможность индексации данных, полнотекстового поиска, разграничения прав доступа по узлам и ветвям, а также восстановления данных при повреждении персистентного адресного пространства.",
  "rationale": "Долгосрочная стратегия проекта предполагает эволюцию pjson от библиотеки работы с JSON к полноценной СУБД. Архитектура леса AVL-деревьев с pstringview и фиксированными типами деревьев для каждого типа узла может обеспечить эти возможности универсально и эффективно.",
  "status": "proposed",
  "priority": "high",
  "version": "1.0",
  "created": "2026-03-22",
  "author": "netkeep80",
  "traces_from": ["BR-001"],
  "traces_to": ["FR-009", "FR-010", "FR-011", "FR-012", "FR-013"],
  "implementation_files": [],
  "test_files": [],
  "acceptance_criteria": [
    "Архитектура pjson допускает построение СУБД-функциональности без переписывания базовых компонентов",
    "Каждый тип узла pjson имеет выделенное AVL-дерево с фиксированным идентификатором типа",
    "Итерация по всем узлам определённого типа возможна через AVL-дерево этого типа",
    "Архитектура допускает добавление индексов, полнотекстового поиска и контроля доступа"
  ],
  "tags": ["architecture", "dbms", "strategy", "avl-tree"]
}
