{
  "id": "BR-001",
  "type": "business",
  "title": "Библиотека персистентного JSON для персистентного адресного пространства",
  "description": "pjson должна предоставлять JSON-подобный API (аналогичный nlohmann::json) для работы с JSON-структурами данных, хранящимися в персистентном адресном пространстве, управляемом PersistMemoryManager (pmm). Все данные сохраняются между перезапусками процесса без явной сериализации/десериализации.",
  "rationale": "Приложениям необходим удобный, знакомый JSON API, работающий непосредственно с персистентной памятью, исключающий накладные расходы на преобразование между представлениями в оперативной памяти и на диске.",
  "status": "approved",
  "priority": "critical",
  "version": "1.0",
  "created": "2026-03-21",
  "author": "netkeep80",
  "traces_from": [],
  "traces_to": ["SR-001", "SR-002", "SR-003", "NFR-001", "NFR-002", "CR-001", "BR-003"],
  "implementation_files": [],
  "test_files": [],
  "acceptance_criteria": [
    "Библиотека предоставляет API для создания, чтения, обновления и удаления JSON-значений в персистентной памяти",
    "Данные сохраняются между перезапусками процесса без явной сериализации/загрузки",
    "API эргономичен и аналогичен nlohmann::json, где это применимо"
  ],
  "tags": ["core", "architecture"]
}
