{
  "id": "NFR-002",
  "type": "nonfunctional",
  "title": "Только POD-типы для персистентных данных",
  "description": "Все типы, хранящиеся в персистентной памяти, должны быть тривиально копируемыми (POD). Это гарантирует, что весь образ памяти можно сохранить и загрузить как сырые байты без логики сериализации.",
  "rationale": "Тривиально копируемые типы позволяют сохранять и восстанавливать образ памяти pmm через сырой байтовый ввод-вывод, что является основным механизмом персистентности.",
  "status": "approved",
  "priority": "critical",
  "version": "1.0",
  "created": "2026-03-21",
  "author": "netkeep80",
  "traces_from": ["BR-001"],
  "traces_to": [],
  "implementation_files": [],
  "test_files": [],
  "acceptance_criteria": [
    "static_assert(std::is_trivially_copyable_v<T>) для всех персистентных типов",
    "Нет виртуальных функций, нетривиальных конструкторов или указателей в персистентных типах"
  ],
  "tags": ["persistence", "pod", "constraint"]
}
