{
  "id": "FR-014",
  "type": "functional",
  "title": "Унификация типа AVL-дерева и типа JSON-узла: pptr как динамический тип",
  "description": "pjson должна использовать тип AVL-дерева (поле node_type в TreeNode pmm) в качестве единственного идентификатора типа JSON-узла, устраняя необходимость в отдельном теге типа (node_tag) внутри структуры узла. pptr становится динамическим типом: его тип определяется не шаблонным параметром compile-time, а полем node_type в TreeNode, в котором этот узел хранится. Таким образом, один и тот же pptr может указывать на узел любого типа pjson, а определение типа происходит через чтение node_type соответствующего TreeNode в runtime. Это существенно экономит персистентное адресное пространство (ПАП), так как устраняется дублирование информации о типе (tag в структуре узла + node_type в TreeNode).",
  "rationale": "В текущей архитектуре тип JSON-узла хранится в двух местах: (1) в поле node_tag внутри структуры pjson_node и (2) в поле node_type дерева TreeNode в лесе AVL-деревьев pmm (FR-009). Это избыточно — node_type уже однозначно определяет тип узла. Унификация устраняет дублирование, уменьшает размер структуры узла, экономит ПАП и упрощает архитектуру. pptr при этом становится универсальным динамическим указателем: его тип определяется не на этапе компиляции, а по node_type TreeNode в runtime.",
  "status": "proposed",
  "priority": "critical",
  "version": "1.0",
  "created": "2026-03-22",
  "author": "netkeep80",
  "traces_from": ["BR-002", "FR-002", "FR-009"],
  "traces_to": [],
  "implementation_files": [],
  "test_files": [],
  "acceptance_criteria": [
    "Тип JSON-узла определяется исключительно через поле node_type в TreeNode pmm, без отдельного тега типа в структуре узла",
    "pptr является динамическим типом: один и тот же pptr может указывать на узлы разных типов pjson",
    "Определение типа узла по pptr выполняется через чтение node_type в TreeNode за O(1)",
    "Структура pjson_node не содержит поля node_tag — тип определяется контекстом дерева",
    "Экономия ПАП подтверждена: размер структуры узла уменьшен на размер поля тега",
    "Все операции API (get, put, erase, iterate) корректно работают с динамической типизацией через node_type"
  ],
  "tags": ["core", "architecture", "avl-tree", "pptr", "dynamic-type", "optimization"]
}
