{
  "id": "FR-010",
  "type": "functional",
  "title": "Итераторы по типизированным AVL-деревьям узлов pjson",
  "description": "pjson должна предоставлять итераторы для обхода всех узлов определённого типа через соответствующее AVL-дерево. Например, итератор по дереву с типом 4 (parray) позволяет перебрать все JSON-массивы в персистентном адресном пространстве, а итератор по дереву с типом 1 ($ref) — все ссылки.",
  "rationale": "Итераторы по типизированным AVL-деревьям необходимы для: (1) построения индексов в СУБД pjson_db; (2) полнотекстового поиска по всем строкам; (3) разрешения всех ссылок $ref; (4) восстановления данных при повреждении ПАП; (5) сборки мусора для неиспользуемых интернированных строк.",
  "status": "proposed",
  "priority": "high",
  "version": "1.0",
  "created": "2026-03-22",
  "author": "netkeep80",
  "traces_from": ["BR-003", "FR-009"],
  "traces_to": [],
  "implementation_files": [],
  "test_files": [],
  "acceptance_criteria": [
    "Предоставляется итератор для обхода AVL-дерева по заданному идентификатору типа",
    "Итератор поддерживает стандартный C++ интерфейс (begin/end, operator++, operator*)",
    "Итератор обеспечивает обход в отсортированном порядке (in-order traversal AVL-дерева)",
    "Итератор корректно работает с пустыми деревьями",
    "Возможно получить количество узлов в дереве заданного типа за O(1)"
  ],
  "tags": ["api", "iterator", "avl-tree", "dbms"]
}
