{
  "id": "BR-002",
  "type": "business",
  "title": "Единая архитектура леса AVL-деревьев",
  "description": "pjson должна использовать ту же архитектурную парадигму леса AVL-деревьев, что и pmm, как для управления памятью, так и для управления хранимыми объектами. Это устраняет функциональное и архитектурное дублирование (например, отдельный механизм пулов в прототипе).",
  "rationale": "Использование единой архитектурной парадигмы (лес AVL-деревьев) как для менеджера памяти, так и для хранимых объектов снижает сложность, дублирование кода и затраты на поддержку. Отдельный пул-аллокатор прототипа вводит избыточную функциональность, которую pmm уже предоставляет.",
  "status": "approved",
  "priority": "critical",
  "version": "1.0",
  "created": "2026-03-21",
  "author": "netkeep80",
  "traces_from": [],
  "traces_to": ["SR-002", "FR-001", "CR-001", "FR-009", "FR-014"],
  "implementation_files": [],
  "test_files": [],
  "acceptance_criteria": [
    "Для управления JSON-узлами не используется отдельный пул-аллокатор",
    "JSON-узлы управляются через выделение на основе AVL-деревьев pmm",
    "Управление памятью и хранение объектов используют одну и ту же парадигму"
  ],
  "tags": ["architecture", "avl-tree", "pmm"]
}
