{
  "id": "FR-009",
  "type": "functional",
  "title": "Выделенные AVL-деревья с фиксированными типами для каждого типа узла pjson",
  "description": "Каждый тип узла pjson должен иметь своё выделенное AVL-дерево в лесе AVL-деревьев pmm с фиксированным (hardcoded) идентификатором типа дерева (node_type в TreeNode). Это означает, что все узлы одного типа (например, все parray, все pstring, все $ref, все $base64) объединены в одно AVL-дерево. Фиксированные идентификаторы типов: 1 — $ref, 2 — $base64, 3 — pstring, 4 — parray, 5 — pjson (корневые узлы). Для pstringview и pmap уже существуют типы деревьев в pmm. Тип ключа K в pmap может быть ограничен только pstringview (требует проверки).",
  "rationale": "Compile-time типизация в pmm для pjson по сути не нужна, поскольку узлы pjson имеют динамический тип. Однако фиксированная привязка идентификаторов типов AVL-деревьев для каждого типа узла pjson позволяет: (1) итерировать все узлы одного типа независимо; (2) индексировать данные по типу для СУБД; (3) восстанавливать повреждённые данные через обход типизированных деревьев.",
  "status": "proposed",
  "priority": "critical",
  "version": "1.0",
  "created": "2026-03-22",
  "author": "netkeep80",
  "traces_from": ["BR-002", "BR-003", "FR-001"],
  "traces_to": ["FR-010", "FR-013"],
  "implementation_files": [],
  "test_files": [],
  "acceptance_criteria": [
    "Каждому типу узла pjson назначен фиксированный идентификатор типа AVL-дерева (node_type)",
    "Идентификаторы типов жёстко заданы: 1=$ref, 2=$base64, 3=pstring, 4=parray, 5=pjson",
    "Все узлы одного типа хранятся в одном AVL-дереве, доступном по идентификатору типа",
    "pstringview и pmap используют существующие типы деревьев из pmm",
    "Проверено, что тип ключа K в pmap<K,V> всегда равен pstringview в контексте pjson"
  ],
  "tags": ["core", "avl-tree", "node-type", "architecture"]
}
